{
  "$comment": "GENERATED by bun nv render — do not edit",
  "$schema": "https://json-schema.org/draft/2020-12/schema",
  "title": "plan_status",
  "type": "object",
  "properties": {
    "status": {
      "type": "string"
    },
    "done": {
      "type": "string"
    },
    "onDisk": {
      "type": "string"
    },
    "toolchain": {
      "type": "string"
    },
    "openNow": {
      "type": "string"
    },
    "blocking": {
      "type": "string"
    }
  },
  "required": [
    "status",
    "done",
    "onDisk",
    "toolchain",
    "openNow",
    "blocking"
  ],
  "additionalProperties": false
}
