{
  "status": "**The language, `Core`, concurrency and script isolates, configuration and capabilities, the built-in HTTP server, the stdlib and the five SQL drivers, and the extension system are built**, with the editor support and the four built-in components: image, intl, PDF and spreadsheet. Goal `completeness-holes` is closing the holes a completeness audit found, a memory-safety bug first. Dependencies: `regex` + `fancy-regex` and `jiff` are named by the user; the rest the loop picks under `rule:packaging/a-c-dependency-answers-two-questions`.",
  "done": "Everything the Status field names as built. A finished milestone's scope file and record are deleted, so the table below lists only the milestones still ahead, and `git log` is the history.",
  "onDisk": "the workspace and its CI (three platforms, with miri, asan, tsan and fuzz legs); 21 crates under `crates/`, from `nvs-syntax` to `nvs-server`; the four built-in components under `extensions/` and their WIT worlds under `wit/`; `fuzz/`, `tools/`, `benches/`, `editors/vscode` and `website/`; and the case trees under `tests/`, `tests/conformance` the largest. **Each crate's own module doc is the authority on what it holds and what it still owes**; `bun nv brief` prints one map line each, and `bun nv disk` the live counts.",
  "toolchain": "Rust 1.99.1 stable (pinned), Cranelift 0.136, wasmtime 49, MSVC 14.50 + Windows SDK 10.0.26100 for linking, PHP 8.5.11, optional and used by the PHP benchmarks only, `cargo-fuzz` 0.13.2 and `valgrind` under a WSL nightly toolchain (docs/setup.md is what a machine installs, and why).",
  "openNow": "**Looper's chain, `docs/goals/README.md`, is the list of what is open**, in the order the loop walks it, and each goal is its file under `docs/goals/`. This field restates neither. A goal's plan is its own front matter: looper deletes a goal once it is reached and carries none of its checks. What a feature still owes of `rule:testing/feature-proofs` is `bun nv proofs --owed`, and what a crate still owes is a gap record under `data/gaps/` naming its owner.",
  "blocking": "Nothing. What a shipped feature still owes is a gap record under `data/gaps/` naming its owner, and the driver's owner gate refuses to reach a goal while a gap still names it, so no goal walks with its gaps open. Every design call a goal reaches is pre-authorized in its own § *Standing decisions*, and picking every dependency but the two the user named is pre-authorized under `rule:packaging/a-c-dependency-answers-two-questions`."
}
